{
  "bsId": "BS-001",
  "prdId": "PRD-001",
  "version": "1.0.0",
  "status": "draft",
  "title": "Build Sequence: <Product/Feature Name> (Part 1 of N)",
  "buildPhilosophy": "<One paragraph: which generation strategy was used and why, what the cut line for first ship is, and any cross-cutting assumptions (e.g. 'auth library already exists', 'observability stack inherited from platform').>",
  "generationStrategy": "dependency-first",
  "buildSequence": [
    {
      "id": "FBS-001",
      "title": "<Short imperative title, no trailing period>",
      "summary": "<1–3 sentences: what this delivers and why it is grouped this way.>",
      "storyScope": [
        {
          "usId": "US-001",
          "acIds": ["AC-001", "AC-002", "AC-003"]
        }
      ],
      "dependencies": [],
      "testableOutcomes": [
        "<Outcome 1 — independently verifiable, traces to an AC in storyScope>",
        "<Outcome 2>",
        "<Outcome 3>"
      ],
      "status": "not-started",
      "sessionMeta": {
        "estimatedSize": "medium",
        "estimatedHours": 5,
        "contextRequirements": {
          "prdSections": ["<PRD theme / section name>"],
          "tadSections": ["<TAD component / section name>"],
          "existingModules": [],
          "schemas": [],
          "externalDocs": [],
          "other": []
        },
        "deliverables": [
          "<Concrete artefact 1 — module, endpoint, test suite, config>",
          "<Concrete artefact 2>"
        ]
      },
      "riskLevel": "medium",
      "domain": "<PRD theme / business domain>",
      "notes": "<Optional caveats, open questions, rollout flags.>"
    },
    {
      "id": "FBS-002",
      "title": "<Next FBS in the build order>",
      "summary": "<…>",
      "storyScope": [
        {
          "usId": "US-002",
          "acIds": ["AC-004", "AC-005"]
        }
      ],
      "dependencies": ["FBS-001"],
      "testableOutcomes": [
        "<…>",
        "<…>"
      ],
      "status": "not-started",
      "sessionMeta": {
        "estimatedSize": "small",
        "estimatedHours": 3,
        "contextRequirements": {
          "prdSections": [],
          "tadSections": [],
          "existingModules": [],
          "schemas": [],
          "externalDocs": [],
          "other": []
        },
        "deliverables": []
      },
      "riskLevel": "low",
      "domain": "<…>"
    }
  ],
  "createdAt": "YYYY-MM-DDTHH:MM:SSZ",
  "updatedAt": "YYYY-MM-DDTHH:MM:SSZ"
}
